DoorMint in Chandivali-andheri East  Mumbai,tel:+912238539367,4th Flooir  Tax Centre  E Wing  Chandivali Farm Road  Chandivali-andheri East  Mumbai - 400072,11
Rinku Electrician & Plumbing Works in Cbd Belapur  Mumbai,tel:+912238530342,Shop No 18  Shiv Darshan  Plot No 1  Sector 15  Cbd Belapur  Navi Mumbai - 400614  Near Reliance Digital,2
Timesaverz Dotcom Pvt Ltd in Andheri West  Mumbai,tel:+912238533992,New Mhada Complex  Andheri West  Mumbai - 400053  Near Lokhandwala Circle,15
Shreeji Electrical Solutions in Bandra West  Mumbai,tel:+912238511439,304  Building No C/ 71  New Link Road  Dahisar  Mumbai - 400068  Near Shiv Mandir  Anand Nagar,12
Huma Electricals in Andheri West  Mumbai,tel:+912238576046,Shop No 6  Qureshi Compound  Veera Desai Road  Andheri West  Mumbai - 400053  Near Mahatma Gandhi School,88
Sadiya Electricals in Andheri West  Mumbai,tel:+912238511903,312  Rahab Building Gaondevi Housing Society  New Link Road  Andheri West  Mumbai - 400053  Opposite Deeraj Gaurav Heights  Near Infinity Mall,5
Arun Electrical in Bandra West  Mumbai,tel:+912238535731,Shop No 3  Mount Marry Road  Bandra West  Mumbai - 400050  Near Mount Mary Steps,3
N B Electricals & Contractor in Ghansoli  Mumbai,tel:+912238558102,Chintamani Apartment  House No 462/463  Shop No 1  Ghansoli  Navi Mumbai - 400701  Gaondevi Wadi  Near MMC Hospital & Post Office,2
Shree Electricals in Vashi  Mumbai,tel:+912238533691,Chandrakant Patil Niwas  Sector 26  Vashi  Navi Mumbai - 400703  Kopari Village  Near Hanuman Temple,2
Satya Electrician in Andheri West  Mumbai,tel:+912238530091,D/22  Shiv Shakti Society  Link Road  Andheri West  Mumbai - 400053  Near Oshiwara Depot,8
A To Z Electric Works in Mira Road  Mumbai,tel:+912238533381,Shop No 4  Sonam Shopping Centre  Phase 6  Mira Bhayander Highway  Mira Road  Thane - 401107  Near Balaji Hospital  Golden Nest,3
A1 Electricals in Chembur West  Mumbai,tel:+912238563087,Shop No 12/ A  Shafi Estate  G M Road  Chembur West  Mumbai - 400089  Opposite Amar Mahal Flyover  Near Manjul Nagar,3
Parsekar Electric Work in Jogeshwari East  Mumbai,tel:+912238535649,Unit No 3  Sento Building  Caves Road  Jogeshwari East  Mumbai - 400060  Behind Bank Of Baroda,2
Wellington Electrical Work in LAL Baug  Mumbai,tel:+912238519770,Shop 4  A Wing  Mohamadi Building 3  Paru Chawl Compound  LAL Baug  Mumbai - 400012  Opposite Lalbaug Market,2
Miranda Electrical in Thane West  Mumbai,tel:+912238558233,Shop No 45  Ghodbandar Road  Thane West  Thane - 400601  Next To Pipe Line  Near Cine Wonder   Kaparvaudi  Palika Bazar,12
Vaibhav Electrical in Naigaon-Dadar East  Mumbai,tel:+912238536223,569/9 Kohinoor Mill Compound  M J Phule Road  Naigaon-Dadar East  Mumbai - 400014  Near Purandare Stadium,2
Book My Task Services in Andheri West  Mumbai,tel:+912238534111,502  Morya Classic  Off New Link Road  Andheri West  Mumbai - 400053  Near Infinity Mall  Oshiwara,3
Shubh Om Electric in Kandivali East  Mumbai,tel:+912238582264,Shop No 25  Building No 4  Evershine Millenium Paradise  Kandivali East  Mumbai - 400101  Thakur Village,33
